mood_choice,quote_type,body,author
Disappointment,Inspirational,"You can do anything, but not everything.",David Allen
Insult,Inspirational,"Perfection is achieved, not when there is nothing more to add, but when there is nothing left to take away.",Antoine de Saint-Exupéry
Insult,Inspirational,"The richest man is not he who has the most, but he who needs the least.",Unknown Author
Depressed,Inspirational,You miss 100 percent of the shots you never take.,Wayne Gretzky
Agony,Inspirational,"Courage is not the absence of fear, but rather the judgement that something else is more important than fear.",Ambrose Redmoon
Agony,Inspirational,You must be the change you wish to see in the world.,Gandhi
Insult,Inspirational,"When hungry, eat your rice; when tired, close your eyes. Fools may laugh at me, but wise men will know what I mean.",Lin-chi
Disappointment,Inspirational,The third-rate mind is only happy when it is thinking with the majority. The second-rate mind is only happy when it is thinking with the minority. The first-rate mind is only happy when it is thinking.,A. A. Milne
Depressed,Inspirational,"To the man who only has a hammer, everything he encounters begins to look like a nail.",Abraham Maslow
Disappointment,Inspirational,"We are what we repeatedly do; excellence, then, is not an act but a habit.",Aristotle
Sorrow,Inspirational,A wise man gets more use from his enemies than a fool from his friends,Baltasar Gracian
Disappointment,Inspirational,Do not seek to follow in the footsteps of the men of old; seek what they sought.,Basho
Depressed,Inspirational,Everyone is a genius at least once a year. The real geniuses simply have their bright ideas closer together.,Georg Christoph Lichtenberg
Depressed,Inspirational,"What we think, or what we know, or what we believe is, in the end, of little consequence. The only consequence is what we do.",John Ruskin
Agony,Inspirational,The real voyage of discovery consists not in seeking new lands but seeing with new eyes.,Marcel Proust
Disappointment,Inspirational,"Work like you don’t need money, love like you’ve never been hurt, and dance like no one’s watching",Unknown Author
Insult,Inspirational,"Try a thing you haven’t done three times. Once, to get over the fear of doing it. Twice, to learn how to do it. And a third time, to figure out whether you like it or not.",Virgil Garnett Thomson
Agony,Inspirational,"Even if you’re on the right track, you’ll get run over if you just sit there.",Will Rogers
Sorrow,Inspirational,"People often say that motivation doesn’t last. Well, neither does bathing – that’s why we recommend it daily.",Zig Ziglar
Disappointment,Inspirational,"What the world needs is more geniuses with humility, there are so few of us left.",Oscar Levant
Sorrow,Inspirational,Always forgive your enemies; nothing annoys them so much.,Oscar Wilde
Insult,Inspirational,The person who reads too much and uses his brain too little will fall into lazy habits of thinking.,Albert Einstein
Depressed,Inspirational,It is the mark of an educated mind to be able to entertain a thought without accepting it.,Aristotle
Agony,Inspirational,"We learn something every day, and lots of times it’s that what we learned the day before was wrong.",Bill Vaughan
Agony,Inspirational,"Don’t ever wrestle with a pig. You’ll both get dirty, but the pig will enjoy it.",Cale Yarborough
Disappointment,Inspirational,An inventor is simply a fellow who doesn’t take his education too seriously.,Charles F. Kettering
Insult,Inspirational,The cure for boredom is curiosity. There is no cure for curiosity.,Ellen Parr
Depressed,Inspirational,"The trouble with the rat race is that even if you win, you’re still a rat.",Lily Tomlin
Sorrow,Inspirational,Laughing at our mistakes can lengthen our own life. Laughing at someone else’s can shorten it.,Cullen Hightower
Sorrow,Devotional,Choosing to be positive and having a grateful attitude is going to determine how you're going to live your life.,Joel Osteen
Agony,Devotional,"Why don’t you start believing that no matter what you have or haven’t done, that your best days are still out in front of you.",Joel Osteen
Disappointment,Devotional,"God wants us to prosper financially, to have plenty of money, to fulfill the destiny He has laid out for us.",Joel Osteen
Depressed,Devotional,"When you focus on being a blessing, God makes sure that you are always blessed in abundance.",Joel Osteen
Sorrow,Devotional,Faith activates God - Fear activates the Enemy.,Joel Osteen
Insult,Devotional,"You can change your world by changing your words... Remember, death and life are in the power of the tongue.",Joel Osteen
Depressed,Devotional,Do all you can to make your dreams come true.,Joel Osteen
Agony,Devotional,"People respond when you tell them there is a great future in front of you, you can leave your past behind.",Joel Osteen
Depressed,Devotional,"No matter how many times you get knocked down, keep getting back up. God sees your resolve. He sees your determination. And when you do everything you can do, that’s when God will step in and do what you can’t do.",Joel Osteen
Insult,Devotional,If we say it long enough eventually we’re going to reap a harvest We’re going to get exactly what we’re saying,Joel Osteen
Disappointment,Devotional,Quit questioning God and start trusting Him,Joel Osteen
Sorrow,Devotional,"This is my Bible, I am what it says I am, I have what it says I have, I can do what it says I can do",Joel Osteen
Depressed,Devotional,"When you are tempted to get discouraged, remind yourself that according to God’s word, your future is getting brighter; you are on your way to a new level of glory You may think you’ve got a long way to go, but you need to look back at how far you’ve already come You may not be everything you want to be but at least you can thank God that you’re not what you used to be",Joel Osteen
Agony,Devotional,"We may get knocked down on the outside, but the key to living in victory is to learn how to get up on the insid",Joel Osteen
Sorrow,Devotional,"If you’ll dare to take your mind off your troubles, get your mind off your own needs and, instead, seek to be a blessing to other people, God will do more for you than you could even ask or think",Joel Osteen
Disappointment,Devotional,"Don’t grow accustomed to living with less, doing less, and being less to the point that you eventually sit back and accept it",Joel Osteen
Depressed,Devotional,"Every day is a gift from God There’s no guarantee of tomorrow, so that tells me to see the good in this day to make the most of it",Joel Osteen
Agony,Devotional,"I believe if you keep your faith, you keep your trust, you keep the right attitude, if you’re grateful, you’ll see God open up new doors",Joel Osteen
Insult,Devotional,"You were not created to just get by with an average, unrewarding, or unfulfilled life God created you to leave your mark on this generation",Joel Osteen
Insult,Devotional,"Any of us can be happy and have a good attitude when everything is going our way But I believe it’s the real test of your character and of your faith to say, ‘Things are not going our way, but I’m still being good to people; I’m still attending church; I still have a good attitude ’",Joel Osteen
Sorrow,Devotional,"God made us for more than just barely getting by We weren’t meant to sit on the sidelines of life because with God, we are on the winning team!",Joel Osteen
Disappointment,Devotional,"There is always bad news That’s one report, but we have another report It says you are blessed, you are talented, you are creative!",Joel Osteen
Depressed,Devotional,"I realized that worry, fear, and wrong thinking are not simply bad habits They allowt he negative to come to pass",Joel Osteen
Agony,Devotional,Fear and faith have something in common Both ask us to believe something that we cannot see,Joel Osteen
Depressed,Devotional,"when you come to a closed door, regard that as God nudging you in a better direction",Joel Osteen
Insult,Devotional,You must quit looking at what you don’t have and start believing that all things are possible,Joel Osteen
Disappointment,Devotional,"Too many people have gotten comfortable, settled where they are and become too easily satisfied – time to stretch!",Joel Osteen
Agony,Devotional,You didn’t just show up on planet Earth by accident You were handpicked by Almighty God,Joel Osteen
Depressed,Devotional,The key to future success is to not be discouraged about your past or present while you are in the process of being completed,Joel Osteen
Sorrow,Devotional,"Take your dreams and the promises God has put in your heart, and every day declare that they will come to pass",Joel Osteen
